cnpj,raiz_cnpj,matriz_filial,razao_social,opcao_pelo_simples,capital_social
155991000181,155991,MATRIZ,ELEKTI - APOIO A EDUCACAO E FORNECIMENTO DE BOLSAS DE ESTUDOS LTDA,NAO,40000
606458000199,606458,MATRIZ,MERCODATA ENGENHARIA DE SISTEMAS LTDA,NAO,50000
714851000104,714851,MATRIZ,MKT SERVICOS DE MARKETING E TECNOLOGIA - EIRELI,NAO,320000
841331000154,841331,MATRIZ,SOFTNEW SISTEMAS E CONSULTORIA EM INFORMATICA LTDA,SIM,15000
846686000136,846686,MATRIZ,HORUS INFORMATICA LTDA,NAO,200000
1302359000186,1302359,MATRIZ,UNIWARE CONS E COMERCIO DE EQUIP P/ INFORMATICA LTDA,NAO,60000
1412181000126,1412181,MATRIZ,DIFERENZA CONSULTORIA EM TECNOLOGIA EIRELI,NAO,600000
1493662000103,1493662,MATRIZ,TRIPLICE CONSULTORIA E SERVICOS LTDA,SIM,50000
1579286000174,1579286,MATRIZ,SAFEWEB SEGURANCA DA INFORMACAO LTDA.,NAO,10100000
1718839000122,1718839,MATRIZ,E. SILVA CONSULTORIA LTDA,NAO,20000
2265894000177,2265894,MATRIZ,ISO ENTERPRISE INFORMATICA LTDA,NAO,259999
2306226000140,2306226,MATRIZ,LUME SERVICOS DE TECNOLOGIA S/A,NAO,5000000
2314840000154,2314840,MATRIZ,UNIDAC CONSULTORIA EM TECNOLOGIA DA INFORMACAO LTDA,SIM,100000
2318794000161,2318794,MATRIZ,EVERTON RAMOS DE MORAES EIRELI,SIM,105000
2437196000101,2437196,MATRIZ,"LUMINA - INFORMATICA, CONSULTORIA E SERVICOS LTDA",SIM,20000
2513147000100,2513147,MATRIZ,BENDITO LTDA,NAO,24000
2622879000139,2622879,MATRIZ,C R NET LTDA,SIM,60000
2716083000145,2716083,MATRIZ,BRAZPINE SERVICE SERVICOS PROCESSOS TECNOLOGIA LTDA,NAO,100000
2816751000106,2816751,MATRIZ,PARADIGMA BUSINESS SOLUTIONS LTDA,NAO,4000000
2904609000110,2904609,MATRIZ,FATOR I CONSULTORIA LTDA,NAO,25000
2908992000185,2908992,MATRIZ,EXECUCAO GESTAO E CONSULTORIA EM INFORMATICA LTDA.,NAO,1500000
3078155000139,3078155,MATRIZ,CABLING TELECOM E CONSULTORIA EIRELI,NAO,95400
3158860000146,3158860,MATRIZ,PELISSARI INFORMATICA SA,NAO,6500500
3182155000184,3182155,MATRIZ,ECORE SOLUCOES EM TECNOLOGIA DA INFORMACAO LTDA.,NAO,300000
3271868000114,3271868,MATRIZ,GUIAINVEST SERVICOS DE TECNOLOGIA DA INFORMACAO LTDA,NAO,48503
3339370000146,3339370,MATRIZ,INTERACT SOLUTIONS LTDA,NAO,1000000
3456658000109,3456658,MATRIZ,PLANETAWEB INFORMATICA LTDA,SIM,50000
3624861000139,3624861,MATRIZ,HANDS ON TECNOLOGIA DA INFORMACAO LTDA,NAO,10000
3650551000199,3650551,MATRIZ,WELAB.BUSINESS COMUNICACAO DIGITAL EIRELI,NAO,250000
3693940000100,3693940,MATRIZ,E-PEOPLE SOLUCOES LTDA,NAO,1425000
3768803000189,3768803,MATRIZ,MITI - MIDIA INTERATIVA E TECNOLOGIA DA INFORMACAO LTDA,NAO,5472116
3842870000104,3842870,MATRIZ,FERAWEB INFORMATICA LTDA,NAO,15000
3869517000100,3869517,MATRIZ,AMBX TECNOLOGIA LTDA,NAO,500000
3942659000155,3942659,MATRIZ,VIGA NETSTORE LTDA,NAO,60000
4055601000152,4055601,MATRIZ,BECOMEX CONSULTORIA LTDA,NAO,282002
4055839000188,4055839,MATRIZ,TEROS INFORMATICA LTDA,SIM,10000
4067290000141,4067290,MATRIZ,DHBYTE SOFTWARE ESPECIALISTA S/S LTDA,NAO,10000
4121834000106,4121834,MATRIZ,MACNICA DHW LTDA,NAO,21350251
4340744000106,4340744,MATRIZ,TECHNORIVER INFORMATICA LTDA,SIM,10000
4358494000131,4358494,MATRIZ,CINQ TECHNOLOGIES LTDA,NAO,7990586
4363802000117,4363802,MATRIZ,NASCENT CONSULTORIA LTDA,NAO,10000
4432166000138,4432166,MATRIZ,ROBERTO DE SOUZA PASQUALOTTO & CIA LTDA,NAO,20000
4570566000100,4570566,MATRIZ,SEGWARE DO BRASIL LTDA,NAO,650000
4864355000180,4864355,MATRIZ,VIAFLOW CONSULTORIA E SISTEMAS LTDA,NAO,70000
4915134000193,4915134,MATRIZ,DRZ GEOTECNOLOGIA E CONSULTORIA LTDA,NAO,2000000
5023602000188,5023602,MATRIZ,ASSERTIVA TECH CONSULTORIA EM TI LTDA,SIM,8000
5050074000156,5050074,MATRIZ,IMMEDIATE CONSULTORIA E SISTEMAS LTDA,NAO,250000
5110958000159,5110958,MATRIZ,GTI GESTAO DA TECNOLOGIA DA INFORMACAO LTDA,NAO,10000
5138645000109,5138645,MATRIZ,M2A TECNOLOGIA E GESTAO DA INFORMACAO - EIRELI,NAO,67800
5151009000117,5151009,MATRIZ,SMART CONSULTORIA EM TECNOLOGIA DA INFORMACAO LTDA,NAO,10000
5159145000153,5159145,MATRIZ,"IDDEIA COMERCIO, LOCACAO E SOLUCOES TECNOLOGICAS EIRELI",NAO,4500000
5332252000131,5332252,MATRIZ,KIONUX SOLUCOES EM INTERNET LTDA,NAO,34000
5337875000105,5337875,MATRIZ,NEOWAY TECNOLOGIA INTEGRADA ASSESSORIA E NEGOCIOS SA,NAO,113860009
5357530000105,5357530,MATRIZ,GLOBALWIDE TECNOLOGIA E INFORMATICA LTDA,SIM,10000
5401067000151,5401067,MATRIZ,TEIKO SOLUCOES EM TECNOLOGIA DA INFORMACAO LTDA,NAO,100000
5422311000162,5422311,MATRIZ,KAIZENDO SOLUCOES E SISTEMAS PARA MELHORIA LTDA,SIM,240000
5448669000164,5448669,MATRIZ,MAURICIO RIBEIRO INFORMATICA LTDA,SIM,100000
5451225000188,5451225,MATRIZ,OPSERVICES TECNOLOGIA DA INFORMACAO S.A,NAO,400000
5488710000126,5488710,MATRIZ,APICE -REPRESENTACAO E INTEGRACAO DE SISTEMAS EIRELI,NAO,103000
5531121000183,5531121,MATRIZ,INTERGATE CONSULTORIA DIGITAL LTDA,NAO,78800
5546793000162,5546793,MATRIZ,GO ON CONSULTORIA EM TECNOLOGIA DA INFORMACAO LTDA,NAO,600000
5550374000102,5550374,MATRIZ,DLB TECNOLOGIA LTDA,NAO,6848380
5594470000144,5594470,MATRIZ,TRAJECTA SISTEMAS DE INFORMATICA LTDA,NAO,10000
5617100000185,5617100,MATRIZ,"BUNDT CONSULTORIA, EDUCACAO & PARTICIPACOES LTDA",NAO,30000
5620370000145,5620370,MATRIZ,SUPERINTEROP SUPORTE EM INFORMATICA LTDA,NAO,20000
5809591000166,5809591,MATRIZ,BR CAPTURA - EMPRESA BRASILEIRA DE REDE DE CAPTURA S.A,NAO,200000
5895166000137,5895166,MATRIZ,FSK INFORMATICA LTDA,NAO,20000
5906225000125,5906225,MATRIZ,AUDARE INFORMATICA SS LTDA,NAO,210000
5996262000171,5996262,MATRIZ,MASTER&PRO CONSULTORIA E DESENVOLVIMENTO DE PROGRAMAS LTDA,SIM,10000
6015379000190,6015379,MATRIZ,FIAPO LABS TECNOLOGIA DA INFORMACAO LTDA,SIM,10000
6074087000128,6074087,MATRIZ,ZERO-DEFECT INFORMATICA LTDA,NAO,100000
6153856000183,6153856,MATRIZ,ISOLVE - SOLUCOES EM INFORMATICA LTDA,SIM,15000
6185897000151,6185897,MATRIZ,ATGMASTERS LTDA,NAO,10000
6277224000121,6277224,MATRIZ,EQUIPE DIGITAL TECNOLOGIA LTDA,SIM,70000
6290671000110,6290671,MATRIZ,AMBIENTE LIVRE ASSESSORIA EM SISTEMAS DE INFORMATICA LTDA,SIM,120000
6320344000164,6320344,MATRIZ,GSW SUL SOLUCOES DE INFORMATICA LTDA,NAO,50000
6867750000141,6867750,MATRIZ,ITECNOLOGYS CONSULTORIA EM SISTEMAS LTDA,SIM,300000
6913250000107,6913250,MATRIZ,A. D. TURRI TECNOLOGIA,SIM,12000
7052633000192,7052633,MATRIZ,TEKANN TECNOLOGIA DA INFORMACAO LTDA.,NAO,100200
7138892000130,7138892,MATRIZ,KORBER SUPPLY CHAIN BR LTDA,NAO,1623407
7143006000167,7143006,MATRIZ,WAY2 SERVICOS DE TECNOLOGIA S.A.,NAO,1435605
7144407000131,7144407,MATRIZ,VERSUL TECNOLOGIA DE ACESSO INTELIGENTE LTDA,NAO,100000
7208334000102,7208334,MATRIZ,MERCADO DOS SONHOS LTDA,NAO,10000
7303726000142,7303726,MATRIZ,NETMANAGEMENT INFORMATICA LTDA,NAO,1000000
7591060000175,7591060,MATRIZ,4RESULTS LTDA,NAO,580000
7592315000114,7592315,MATRIZ,NTT DATA BUSINESS SOLUTIONS - SERVICOS DE TECNOLOGIA LTDA,NAO,1434000
7672361000123,7672361,MATRIZ,FABIO L A SOTO,NAO,135000
7723137000113,7723137,MATRIZ,SLATER IT SOLUTIONS CONSULTORIA EM INFORMATICA LTDA,NAO,50000
7731452000192,7731452,MATRIZ,TYTANIO TECNOLOGIA - EIRELI,SIM,110000
7896865000127,7896865,MATRIZ,DANIEL HENRIQUE ALVES,SIM,30000
7899023000129,7899023,MATRIZ,SULWORK TECNOLOGIA E SISTEMAS DE INFORMATICA LTDA,NAO,1000000
7941604000181,7941604,MATRIZ,MFC INFORMATICA LTDA,NAO,10000
7944196000111,7944196,MATRIZ,ACESSAR - SOLUCOES EM INFORMATICA LTDA,NAO,10000
7989117000199,7989117,MATRIZ,ADIANTI SOLUCOES EM INFORMATICA LTDA,NAO,28000
8029924000122,8029924,MATRIZ,NET1 - CONSULTORIA EM INFORMATICA E LOCACAO DE BENS - EIRELI,NAO,445000
8150225000136,8150225,MATRIZ,VELITI SOLUCOES LTDA,SIM,25000
8533856000134,8533856,MATRIZ,"B X T COMERCIO, SERVICOS, IMPORTACAO E EXPORTACAO DE SOFTWARE LTDA",NAO,80000
8597777000197,8597777,MATRIZ,TCB CONSULTORIA E EMPREENDIMENTOS EIRELI,NAO,110000
8640367000181,8640367,MATRIZ,DICE INFORMATICA LTDA,SIM,9000
8671358000158,8671358,MATRIZ,DIGITAL UP - TECNOLOGIA EM SISTEMAS LTDA,SIM,500000
8682040000172,8682040,MATRIZ,O.S. SYSTEMS SOFTWARE LTDA,NAO,180000
8716906000119,8716906,MATRIZ,DUOPACTO CONSULTORIA E SISTEMAS LTDA,NAO,6000
8765613000121,8765613,MATRIZ,SOLUTTIONS - SOLUCAO EM TECNOLOGIA LTDA,NAO,481000
8851703000135,8851703,MATRIZ,RAF TELECOM LTDA,NAO,45000
8879628000110,8879628,MATRIZ,QUIRIUS SOLUCOES EM INFORMATICA LTDA,NAO,58781
9008823000138,9008823,MATRIZ,FTI TECNOLOGIA DA INFORMACAO LTDA,NAO,10000
9044119000130,9044119,MATRIZ,AVA TECNOLOGIA LTDA,SIM,100000
9052375000170,9052375,MATRIZ,E-NET COMERCIO DE PRODUTOS E SERVICOS DE INFORMATICA LTDA,NAO,10000
9129117000144,9129117,MATRIZ,MACHINE LOCADORA LTDA,NAO,10000
9176594000160,9176594,MATRIZ,BECOMEX DIGITAL SERVICOS DE CONSULTORIA LTDA,NAO,100000
9251361000185,9251361,MATRIZ,DB TECNOLOGIA DA INFORMACAO EIRELI,NAO,62200
9254750000164,9254750,MATRIZ,EASYBYTE INFORMATICA LTDA.,SIM,30000
9276674000198,9276674,MATRIZ,EASYONE CONSULTORIA LTDA,NAO,70000
9311034000171,9311034,MATRIZ,FERNANDO OMAR SIMON MADERA,NAO,10000
9349805000110,9349805,MATRIZ,INDYXA SERVICOS E SOLUCOES EM TECNOLOGIA DA INFORMACAO LTDA,NAO,100000
9401653000157,9401653,MATRIZ,R.J.D. CONSULTORIA E TECNOLOGIA PARA NEGOCIOS LTDA,NAO,16666
9416343000106,9416343,MATRIZ,L. F. KASPRIK TECNOLOGIA DA INFORMACAO EIRELI,SIM,100000
9451699000180,9451699,MATRIZ,CONVISO APPLICATION SECURITY S/A,NAO,200000
9653351000176,9653351,MATRIZ,JAMIL ALVES FONSECA,NAO,10000
10241629000187,10241629,MATRIZ,HABITAO EIRELI,SIM,93700
10292174000129,10292174,MATRIZ,PACIFIC CONSULTORIA EM TECNOLOGIA DA INFORMACAO EIRELI,NAO,300000
10320392000120,10320392,MATRIZ,ATM SOLUCOES EM TECNOLOGIA LTDA,SIM,10000
10339359000141,10339359,MATRIZ,CONSULTI - CONSULTORIA EM TECNOLOGIA DA INFORMACAO LTDA,NAO,10000
10348941000174,10348941,MATRIZ,LINCROS TECH SOLUCOES EM SOFTWARE EIRELI,NAO,1087732
10353834000134,10353834,MATRIZ,GE DIGITAL DO BRASIL SERVICOS EM INFORMATICA LTDA.,NAO,17000
10358880000126,10358880,MATRIZ,SERCOMPE SOLUCOES CORPORATIVAS E TECNOLOGICAS LTDA,NAO,10000
10387465000109,10387465,MATRIZ,SERCOMPE SOLUCOES CORPORATIVAS E TECNOLOGICAS LTDA,NAO,10000
10414615000118,10414615,MATRIZ,SPRO CONSULTORIA E INFORMATICA LTDA,NAO,1000000
10415575000129,10415575,MATRIZ,HR PROCESSAMENTO DE DADOS LTDA,NAO,45000
10436009000101,10436009,MATRIZ,MURA INFORMATICA LTDA,NAO,10000
10468447000143,10468447,MATRIZ,PRIME CONTROL CONSULTORIA LTDA,NAO,3091190
10469390000105,10469390,MATRIZ,BBP ADMINISTRADORA DE BENS IMOVEIS PROPRIOS LTDA,NAO,6000000
10472415000111,10472415,MATRIZ,BESTSOFT HARDWARE E LICENCIAMENTO DE SOFTWARE LTDA,SIM,10000
10509713000139,10509713,MATRIZ,MAXCOMPRA - CONSULTORIA EMPRESARIAL LTDA.,NAO,20000
10570173000107,10570173,MATRIZ,POLARIS PARTICIPACOES SOCIETARIAS LTDA,NAO,2250000
10655518000117,10655518,MATRIZ,ZIESEMER & CIA LTDA,SIM,10000
10657602000170,10657602,MATRIZ,CONTE SERVICOS DE INFORMATICA LTDA.,NAO,10000
10721973000173,10721973,MATRIZ,VIBROACUSTICA DESENVOLVIMENTO E PESQUISA LTDA,NAO,20000
10732355000129,10732355,MATRIZ,PETRIKOR DESIGN GRAFICO LTDA,SIM,30000
10778277000101,10778277,MATRIZ,TIAGO DA SILVA PRADO,NAO,50000
10803704000156,10803704,MATRIZ,J. MARCHI ASSESSORIA EM ENGENHARIA E INFORMATICA LTDA,SIM,10000
10882234000163,10882234,MATRIZ,ELITE TRADER ASSESSORIA E CONSULTORIA EMPRESARIAL LTDA,SIM,15000
11030542000123,11030542,MATRIZ,SANTOS & CARLESSO LTDA,SIM,30000
11036060000180,11036060,MATRIZ,H. F. CABRAL - EIRELI,SIM,100000
11038137000151,11038137,MATRIZ,GODZ GOVERNANCA E CONSULTORIA EMPRESARIAL LTDA,SIM,84400
11094781000147,11094781,MATRIZ,KRN CONSULTORIA E TECNOLOGIA LTDA,NAO,80000
11152463000195,11152463,MATRIZ,MK DO BRASIL CONSULTORIA EM TI LTDA,NAO,500000
11204307000120,11204307,MATRIZ,MOOVE.ON CONSULTORIA EM INOVACAO LTDA,NAO,20000
11211970000152,11211970,MATRIZ,I 360 SOLUCOES PARA INTERACAO E COMUNICACAO CORPORATIVA LTDA,NAO,100000
11247373000188,11247373,MATRIZ,ARROBAINFO SOLUCOES EM INFORMATICA LTDA,SIM,30000
11381069000129,11381069,MATRIZ,JOAO ANTUNES RIBEIRO JUNIOR,SIM,10000
11482819000159,11482819,MATRIZ,DMX CONSULTORIA EM TECNOLOGIA DA INFORMACAO EIRELI,NAO,104500
11564730000131,11564730,MATRIZ,IMAPS INTELLIGENCE LTDA,NAO,50000
11595710000128,11595710,MATRIZ,SHELTERIT SEGURANCA DIGITAL TRIBUTARIA S/A,NAO,300000
11595801000163,11595801,MATRIZ,ALIPRANDINI CONSULTORIA LTDA,NAO,20000
11738958000109,11738958,MATRIZ,DANIEL APARECIDO DE TOLEDO VIANA,SIM,10000
11902187000135,11902187,MATRIZ,INLINUX INFORMATICA LTDA,NAO,10000
11958556000101,11958556,MATRIZ,ASK CONSULTORIA E SISTEMAS LTDA,NAO,20000
12028803000133,12028803,MATRIZ,"VAR3F, CONSULTORIA INFORMATICA E SISTEMAS LTDA",NAO,50000
12231412000111,12231412,MATRIZ,VIRTUA VISION SYSTEMS EIRELI,NAO,80000
12324285000103,12324285,MATRIZ,HCM CONSULTING SERVICOS DE CONSULTORIA LTDA.,NAO,80000
12330337000146,12330337,MATRIZ,BEMACHI SORTEMOBIL SERVICOS DE INFORMATICA LTDA.,NAO,1200000
12350970000104,12350970,MATRIZ,EITI SOLUCOES DE TECNOLOGIA LTDA,NAO,85225
12803041000103,12803041,MATRIZ,IXS TECNOLOGIA DA INFORMACAO LTDA,NAO,7625
12861549000150,12861549,MATRIZ,REIS & BERNARDES CONSULTORIA E REPRESENTACOES LTDA,NAO,10000
12957904000199,12957904,MATRIZ,ZERO OU UM NEGOCIOS DIGITAIS LTDA,SIM,40000
13095751000180,13095751,MATRIZ,F. ALMEIDA CONSULTORIA EMPRESARIAL LTDA,NAO,20000
13178989000170,13178989,MATRIZ,MULTI CONSULTORIA E TECNOLOGIA EIRELI,SIM,88000
13224486000193,13224486,MATRIZ,FUSION INFORMATICA LTDA,NAO,100000
13292648000120,13292648,MATRIZ,INCITE TECNOLOGIA DA INFORMACAO LTDA,SIM,30000
13612744000109,13612744,MATRIZ,PLIGG CONSULTORIA EM TECNOLOGIA DA INFORMACAO LTDA.,SIM,1000000
13630506000126,13630506,MATRIZ,"MIRACH INOVACAO, TECNOLOGIA E SERVICOS EIRELI",NAO,90000
13809874000136,13809874,MATRIZ,FOCO CONSULTORIA EM TECNOLOGIA DA INFORMACAO LTDA,NAO,10000
13963659000195,13963659,MATRIZ,GALAXIA NASCENTE CONSULTORIA LTDA,SIM,10000
13976120000170,13976120,MATRIZ,LAPORTE CONSULTORIA EM TECNOLOGIA DA INFORMACAO EIRELI,NAO,78800
13994051000128,13994051,MATRIZ,GOLIVE CONSULTORIA LTDA,SIM,13500
14063825000160,14063825,MATRIZ,SIMPLEZ CONSULTORIA LTDA,NAO,10000
14147860000167,14147860,MATRIZ,HADAS SERVICOS DE CONSULTORIA EM INFORMATICA LTDA,NAO,10000
14220191000101,14220191,MATRIZ,NEURON CONSULTORIA LTDA,SIM,60000
14371565000190,14371565,MATRIZ,SIKUR CONSULTORIA E GESTAO EMPRESARIAL LTDA.,NAO,7424177
14470857000180,14470857,MATRIZ,LERMEN SYSTEMS LTDA,SIM,10000
14513770000142,14513770,MATRIZ,RED COMMERCE CONSULTORIA E RECRUTAMENTO LTDA,NAO,1246300
14533121000103,14533121,MATRIZ,SEVENIT - CONSULTORIA EM TECNOLOGIA DA INFORMACAO LTDA,NAO,98000
14557997000190,14557997,MATRIZ,INFRACERTA CONSULTORIA LTDA,NAO,6000
14686366000170,14686366,MATRIZ,CONNECT TELEINFORMATICA E CONSULTORIA LTDA,NAO,50000
14699691000178,14699691,MATRIZ,RETAIL CONSULT KSR - SOLUCOES PARA VAREJO LTDA,NAO,155690
14808197000102,14808197,MATRIZ,MURATA TECNOLOGIA DA INFORMACAO LTDA,SIM,20000
14816976000141,14816976,MATRIZ,JOBYLWARE SISTEMAS LTDA,SIM,10000
14911562000100,14911562,MATRIZ,PRATICA CERTIFICACAO DIGITAL LTDA.,SIM,300000
15083648000146,15083648,MATRIZ,KNOW HOW ASSESSORIA EMPRESARIAL LTDA,NAO,10000
15111904000161,15111904,MATRIZ,MLV PRODUTOS E SERVICOS EM TECNOLOGIA DA INFORMACAO LTDA,NAO,120000
15251078000156,15251078,MATRIZ,ROSSI & ZAMBON INFORMATICA LTDA,NAO,10000
15371741000156,15371741,MATRIZ,INTELLYTWO NEGOCIOS & SERVICOS LTDA,NAO,80000
15793046000182,15793046,MATRIZ,MUJEIKO & EICHLER PARTICIPACOES SA,NAO,243146
16528380000171,16528380,MATRIZ,AKQUINET HKS SOLUCOES EM TECNOLOGIA DA INFORMACAO LTDA,NAO,30000
16539305000106,16539305,MATRIZ,UPY SISTEMAS LTDA,NAO,20000
16584899000177,16584899,MATRIZ,SMART SKY SERVICOS LTDA,NAO,20000
16644671000125,16644671,MATRIZ,ANESTECH TECNOLOGIA DA INFORMACAO LTDA,NAO,202706
16800966000143,16800966,MATRIZ,RIC MAIS PARANA LTDA.,NAO,1160000
16801310000145,16801310,MATRIZ,SERCOMPE TECNOLOGIA EM SOFTWARE LTDA,NAO,10000
16890759000127,16890759,MATRIZ,RISKOFIT TECNOLOGIA APLICADA LTDA,NAO,302000
17011419000141,17011419,MATRIZ,UHLIG & KOROVSKY TECNOLOGIA LTDA.,SIM,65000
17052172000101,17052172,MATRIZ,BROWNPIPE CONSULTORIA EM SEGURANCA DA INFORMACAO LTDA.,NAO,10000
17128605000165,17128605,MATRIZ,DIMAT SOLUTIONS - CONSULTORIA EM TECNOLOGIA DA INFORMACAO LTDA,NAO,10000
17437312000160,17437312,MATRIZ,HGSOFT TECNOLOGIA EIRELI,SIM,104500
17654009000119,17654009,MATRIZ,ACE ASSESSORIA E CONSULTORIA EM INFORMATICA EIRELI,NAO,95400
17871176000111,17871176,MATRIZ,BATISTA GESTAO EM SAUDE EIRELI,NAO,10000
17915726000157,17915726,MATRIZ,SMARTI CONSULTORIA E SERVICOS DE TI LTDA,SIM,12000
17948237000100,17948237,MATRIZ,DEFINITE IT TECNOLOGIA DA INFORMACAO LTDA,NAO,10000
17949442000181,17949442,MATRIZ,MALGUEIRO SERVICOS EM TECNOLOGIA DA INFORMACAO LTDA,SIM,10000
18173795000103,18173795,MATRIZ,TEXVN INFORMATICA - EIRELI,SIM,70000
18319172000198,18319172,MATRIZ,TEKOA INFORMACAO E CONECTIVIDADE LTDA,NAO,1000000
18435752000140,18435752,MATRIZ,OKTOPLUS FIDELIDADE LTDA,NAO,799664
18615479000136,18615479,MATRIZ,NEOEP - ENGENHARIA DE PRODUCAO LTDA,NAO,460000
18630834000146,18630834,MATRIZ,TINO TECH INFORMATICA LTDA,NAO,20000
18771570000140,18771570,MATRIZ,VALTECH BRASIL TECNOLOGIA DIGITAL LTDA,NAO,775300
18796297000109,18796297,MATRIZ,PLANO B CONSULTORIA LTDA,SIM,10000
18843171000148,18843171,MATRIZ,BTI ESTRATEGICA CONSULTORIA EM TI LTDA,SIM,10000
19021905000176,19021905,MATRIZ,SUMMIT NETWORKS LTDA,NAO,308100
19122334000166,19122334,MATRIZ,MIDIA CLASS EDITORA LTDA,SIM,10000
19301105000109,19301105,MATRIZ,IMPLEMENTTI TECNOLOGIA EIRELI,SIM,95400
19387204000155,19387204,MATRIZ,M4 GARANTIA CONSULTORIA LTDA,NAO,3504400
19440549000125,19440549,MATRIZ,CTX CONSULTORIA LTDA.,SIM,200000
19688509000105,19688509,MATRIZ,SOCIUM IT CONSULTORIA LTDA,NAO,20000
19716266000163,19716266,MATRIZ,AQL CONSULTORIA EMPRESARIAL E TECNOLOGIA DA INFORMACAO LTDA,SIM,30000
19942131000116,19942131,MATRIZ,AIRWAVE BRASIL TECNOLOGIA LTDA,NAO,25000
19967832000100,19967832,MATRIZ,WORK OUT CONSULTORIA EM TECNOLOGIA DA INFORMACAO LTDA,SIM,10000
20007959000166,20007959,MATRIZ,HYPERCLOUD CONSULTORIA E COMERCIO DE TECNOLOGIA LTDA,NAO,100000
20013675000182,20013675,MATRIZ,KEPHA MENTORIA DE PROJETOS TECNOLOGICOS LTDA,SIM,200000
20093970000196,20093970,MATRIZ,PLICPLAC DESENVOLVIMENTO WEB LTDA.,SIM,10000
20375185000126,20375185,MATRIZ,N. L DA VISITACAO & CIA. LTDA,NAO,25000
20791217000174,20791217,MATRIZ,DOMVS TECNOLOGIA DA INFORMACAO LTDA,NAO,10000
20925274000107,20925274,MATRIZ,TRUE WORK CONSULTORIA E DESENVOLVIMENTO DE SISTEMAS LTDA,NAO,15000
20945553000124,20945553,MATRIZ,ND DESENVOLVIMENTO E CONSULTORIA LTDA,NAO,75000
20980996000156,20980996,MATRIZ,SMA IT SOLUTIONS LTDA,NAO,20000
21295146000181,21295146,MATRIZ,FLM TECNOLOGIA EIRELI,SIM,100000
21388085000105,21388085,MATRIZ,FELICIO CONSULTORIA EIRELI,SIM,98000
21423671000135,21423671,MATRIZ,PORTER GROUP S.A.,NAO,1100000
21491167000172,21491167,MATRIZ,INCA CONSULTORIA DESENVOLVIMENTO E INDUSTRIALIZACAO DE TECNOLOGIAS INOVADORAS EIRELI,SIM,80000
21505378000117,21505378,MATRIZ,BRID CONSULTORIA E SOLUCOES LTDA,NAO,500000
21513996000109,21513996,MATRIZ,PROPUS SCIENCE TECNOLOGIA DA INFORMACAO LTDA,NAO,10000
21584489000166,21584489,MATRIZ,UNICORN TECNOLOGIA E PARTICIPACOES EIRELI,NAO,350000
21682068000178,21682068,MATRIZ,QEXPERT CONSULTORIA EM BUSINESS INTELLIGENCE LTDA.,NAO,45000
21728376000197,21728376,MATRIZ,CSX SOLUCOES LTDA,SIM,30000
21812398000130,21812398,MATRIZ,MRJP CONSULTORIA EM INFORMATICA S/A,NAO,30000
21884232000120,21884232,MATRIZ,NIMBUS NETWORK TECNOLOGIA DA INFORMACAO LTDA,SIM,30000
21916782000183,21916782,MATRIZ,DAYBACK ENERGIA ESTRATEGICA LTDA,SIM,50000
21932891000194,21932891,MATRIZ,AGGRANDIZE SERVICOS DE TECNOLOGIA DA INFORMACAO LTDA,NAO,63000
21935427000151,21935427,MATRIZ,PSAINFO PRESTACAO DE SERVICOS DE INFORMATICA LTDA,NAO,80000
21969334000148,21969334,MATRIZ,TRIVIO TECNOLOGIA LTDA,SIM,129000
21979785000166,21979785,MATRIZ,CENTRO DE TREINAMENTO SAO MATEUS EIRELI,NAO,78800
22007582000170,22007582,MATRIZ,ABSOFT SOLUCOES INTELIGENTES LTDA,SIM,10000
22182361000139,22182361,MATRIZ,DEV4YOU CONSULTORIA EM TECNOLOGIA DA INFORMACAO E PROCESSAMENTO DE DADOS EIRELI,NAO,93700
22282839000100,22282839,MATRIZ,GREATSOFT SISTEMAS DE INFORMACAO LTDA.,NAO,20000
22370057000115,22370057,MATRIZ,DWU SOLUCOES EM TECNOLOGIA DA INFORMACAO LTDA,SIM,42000
22487718000197,22487718,MATRIZ,EXITOS EFICIENCIA EM INFORMACAO E TECNOLOGIA LTDA,NAO,30000
22516315000129,22516315,MATRIZ,EGROUP CONSULTORIA EM TECNOLOGIA DA INFORMACAO LTDA,NAO,15000
22546577000136,22546577,MATRIZ,AVEERE COMERCIO E SERVICOS EM TECNOLOGIA LTDA,NAO,99000
22778608000184,22778608,MATRIZ,NEXITERA CONSULTORIA E SOLUCOES EM TI SA.,NAO,7600691
22940419000166,22940419,MATRIZ,CONAZ TECNOLOGIA S.A,NAO,3483690
22981457000167,22981457,MATRIZ,IDEATOS SOLUCOES EM TECNOLOGIA EIRELI,SIM,99800
23065417000138,23065417,MATRIZ,TRUBR TECHNOLOGY LTDA,SIM,10000
23201941000199,23201941,MATRIZ,DOUGLAS CAETANO JEREMIAS,SIM,10000
23244090000161,23244090,MATRIZ,THEKLA CONSULTORIA DE SISTEMAS EIRELI,SIM,80000
23316396000186,23316396,MATRIZ,BATTISTI & BATTISTI - CONSULTORIA EMPRESARIAL LTDA,SIM,20000
23450854000175,23450854,MATRIZ,WS TECH - SOLUCOES EM T I EIRELI,SIM,115000
23507330000173,23507330,MATRIZ,DIEGO GAFFORELLI PERFEITO,SIM,10000
23516468000139,23516468,MATRIZ,APPIX - INOVACAO EM TECNOLOGIA DA INFORMACAO LTDA,NAO,100000
23595125000107,23595125,MATRIZ,TRESOR BRASIL CONSULTORIA EIRELI,NAO,80000
23635781000196,23635781,MATRIZ,SOLLAR ONE TECNOLOGIA LTDA,NAO,80000
23773859000139,23773859,MATRIZ,ATM 2 SOLUCOES EM TECNOLOGIA LTDA,SIM,10000
24153353000190,24153353,MATRIZ,SELFLESS PRODUTORA LTDA,SIM,100000
24196301000109,24196301,MATRIZ,TRIXX SERVICOS DE INFORMACAO LTDA,NAO,10000
24232219000184,24232219,MATRIZ,UP CONTACT CENTER EIRELI,SIM,89000
24232254000101,24232254,MATRIZ,BERGHAHN DESENVOLVIMENTO DE NEGOCIOS LTDA,SIM,20000
24353595000127,24353595,MATRIZ,EXITUS EMPRESARIAL CONSULTORIA EIRELI,SIM,90000
24362619000104,24362619,MATRIZ,CCS NEGOCIOS & ASSESSORIA EIRELI,SIM,88000
24582772000147,24582772,MATRIZ,"GOI & PEREZ CONSULTORIA, SERVICOS, VENDAS E LOCACOES LTDA",NAO,15000
24586847000168,24586847,MATRIZ,PIXELWOLF CONSULTORIA EM TECNOLOGIA LTDA,NAO,20000
24608207000101,24608207,MATRIZ,MULTIPLA ARQUITETURA E GERENCIAMENTO DE SERVICOS LTDA,SIM,25000
24642438000131,24642438,MATRIZ,ALF CONSULTORIA LTDA,NAO,15000
24642661000189,24642661,MATRIZ,4SOLVE SOFTWARES LTDA,SIM,20000
24688226000195,24688226,MATRIZ,MV TECH SOLUCOES TECNOLOGICAS LTDA,SIM,10000
24762992000152,24762992,MATRIZ,DECOSTORE INFORMACAO E TECNOLOGIA LTDA.,SIM,100000
24980717000105,24980717,MATRIZ,R. A. DE ARAUJO ANTONIAZZI GEOPROCESSAMENTO E TOPOGRAFIA,SIM,6000
25239083000105,25239083,MATRIZ,ESCOTTA CONSULTORIA LTDA,NAO,200000
25245543000108,25245543,MATRIZ,UNI ENTERPRISE SOLUCOES INTELIGENTES EIRELI,SIM,110000
25275126000108,25275126,MATRIZ,ARC TECNOLOGIA E DESENVOLVIMENTO LTDA,NAO,75000
25275641000180,25275641,MATRIZ,PRISMATECH ASSESSORIA EM SISTEMAS DE INFORMATICA EIRELI,SIM,90000
25285557000147,25285557,MATRIZ,ROBOTIMIZE LTDA,SIM,88000
25341444000111,25341444,MATRIZ,CORE SOLUTIONS - AUTOMACAO TECNOLOGICA LTDA,SIM,13000
25533119000150,25533119,MATRIZ,WARP TECNOLOGIA LTDA,SIM,25000
26114425000115,26114425,MATRIZ,EUQUEROINVESTIR TECNOLOGIA LTDA,NAO,88000
26116642000144,26116642,MATRIZ,GP VENTURES LTDA,NAO,600000
26126319000151,26126319,MATRIZ,PERFORMANCE PROCESSOS SUPORTE E CONSULTORIA EM GESTAO EMPRESARIAL EIRELI,NAO,110000
26181064000120,26181064,MATRIZ,MAPA SA - CONSULTORIA E ANALISES SOCIOAMBIENTAIS LTDA,SIM,10000
26214713000141,26214713,MATRIZ,N&J PARTNERS CONSULTORIA E SERVICOS EM INFORMATICA LTDA,NAO,10000
26225132000105,26225132,MATRIZ,INTERANET SOLUCOES EM TI LTDA,SIM,500000
26263353000178,26263353,MATRIZ,BM SISTEMAS DE ANALISE DE DADOS EIRELI,SIM,93700
26346174000102,26346174,MATRIZ,42 SOLUCOES DIGITAIS LTDA,NAO,10000
26468924000100,26468924,MATRIZ,X4 AUTOMACOES LTDA,SIM,10000
26469808000106,26469808,MATRIZ,INLINE TECNOLOGIA EIRELI,SIM,95400
26686159000103,26686159,MATRIZ,AD SOLUCOES DIGITAIS LTDA,SIM,50000
26756002000107,26756002,MATRIZ,ROMARIO ROSA DE ALMEIDA GESTAO EM SAUDE EIRELI,SIM,88000
26771369000191,26771369,MATRIZ,DHARMA DIGITAL - CONSULTORIA E ASSESSORIA DE GESTAO COMERCIAL LTDA.,SIM,10000
26893432000162,26893432,MATRIZ,LSB CRONOS GESTAO DE PRODUCAO LTDA,NAO,10000
26960108000110,26960108,MATRIZ,OPENCONNECT SISTEMAS DE INFORMACAO E TECNOLOGIA LTDA,SIM,10000
27003628000105,27003628,MATRIZ,H SOURCE IT TECNOLOGIA DA INFORMACAO LTDA.,NAO,790000
27090363000111,27090363,MATRIZ,ZERO TI TECNOLOGIA DA INFORMACAO LTDA,SIM,101010
27100089000114,27100089,MATRIZ,DDS CONSULTORIA EM TECNOLOGIA DA INFORMACAO EIRELI,SIM,93700
27106994000181,27106994,MATRIZ,ANDREIA APARECIDA DE OLIVEIRA CORDEIRO EIRELI,SIM,93700
27299019000137,27299019,MATRIZ,ITA INFRA ESTRUTURA DE TELECOM EIRELI,SIM,100000
27372850000177,27372850,MATRIZ,GUEDES CONSULTORES LTDA.,NAO,20000
27456547000152,27456547,MATRIZ,SEO EXPERTS CONSULTORIA EM TECNOLOGIA DA INFORMATICA EIRELI,SIM,93700
27481416000125,27481416,MATRIZ,WLAN REDES SEM FIO SERVICOS EM TECNOLOGIA LTDA,SIM,15000
27649569000139,27649569,MATRIZ,H. DE PAULA SOUZA JUNIOR - CONSULTORIA EM INFORMATICA,SIM,10000
27667548000146,27667548,MATRIZ,HS2 SERVICOS E SOLUCOES DE INFORMATICA LTDA,NAO,100000
27982288000101,27982288,MATRIZ,I. RAMOS & SANTOS CONSULTORIA E ASSESSORIA LTDA,SIM,10000
28027289000151,28027289,MATRIZ,PARTNER SHARE ASSESSORIA E CONSULTORIA EM INFORMATICA EIRELI,NAO,150000
28027477000180,28027477,MATRIZ,CONSULEXPRESS ASSESSORIA E CONSULTORIA EM INFORMATICA EIRELI,NAO,150000
28082914000168,28082914,MATRIZ,RAVAGLIO E SAAB TECNOLOGIA E GESTAO LTDA,SIM,10000
28218561000180,28218561,MATRIZ,BCS ASSESSORIA E CONSULTORIA EM INFORMATICA EIRELI,NAO,150000
28232830000163,28232830,MATRIZ,RODRIGO ARDIGO CONSULTORIA,SIM,10000
28241746000106,28241746,MATRIZ,WITCRED CONSULTORIA EIRELI,SIM,95000
28336299000179,28336299,MATRIZ,PROGRES TECNOLOGIA LTDA,SIM,10000
28340957000104,28340957,MATRIZ,SS CONSULTORIA LTDA,SIM,10000
28341460000100,28341460,MATRIZ,CDC TECNOLOGIA LTDA,NAO,12000
28396501000158,28396501,MATRIZ,DYCK & SANTOS LTDA,SIM,7500
28494539000163,28494539,MATRIZ,GAMMALINK SERVICO DE INFORMATICA LTDA,NAO,100000
28517714000190,28517714,MATRIZ,WTIT GESTAO E CONSULTORIA DE INFORMATICA LTDA,SIM,10000
